ticket_id,created_date,reason_for_contact,sub_reason,member_message,resolution_status,channel,CSAT_score,handle_time_minutes,agent_name
TKT-4401,2026-04-07,Product Quality,Frozen items thawed,"My frozen açaí bowls arrived completely thawed and leaking all over the box. This is the first time I've ordered frozen from Thrive and I'm really disappointed.",resolved,chat,2,7,Sarah Chen
TKT-4402,2026-04-07,Product Quality,Frozen items thawed,"Just got my delivery and the frozen broccoli and frozen berries are both soft and partially thawed. The dry ice was completely gone.",resolved,email,3,5,Mei Lin Tan
TKT-4403,2026-04-07,Shipping,Late delivery,"My order was supposed to arrive Monday and it's now Wednesday. Tracking just says 'in transit' with no updates since Sunday.",open,chat,3,8,Marcus Rivera
TKT-4404,2026-04-07,Billing,Promo code not working,"I'm trying to use THRIVEMORE at checkout for the frozen food discount but it keeps saying 'invalid code'. I copied it exactly from the email you sent me.",resolved,chat,3,9,David Thompson
TKT-4405,2026-04-07,Product Quality,Frozen items thawed,"Ordered frozen salmon fillets and they arrived warm to the touch. Not just thawed — warm. I can't feed this to my family. What is going on with your frozen shipping?",resolved,phone,1,11,Carmen Reyes
TKT-4406,2026-04-07,Membership,Auto-renewal surprise,"I was just charged $60 for an annual membership I forgot I even had. I haven't ordered anything in 4 months. Can I get a refund?",resolved,chat,4,6,Ashley Nguyen
TKT-4407,2026-04-08,Product Quality,Frozen items thawed,"All three frozen pizzas I ordered were thawed and the boxes were soggy. The ice packs in the box were room temperature. This is unacceptable.",resolved,chat,2,7,Tyler Brooks
TKT-4408,2026-04-08,Billing,Promo code not working,"THRIVEMORE code won't work for me. I have it in my cart with frozen items and it says the code doesn't exist. I've been a member since 2022.",resolved,chat,2,10,Sarah Chen
TKT-4409,2026-04-08,Shipping,Damaged in transit,"My jar of coconut oil arrived shattered. Glass everywhere, oil all over my other items. The box had no padding.",resolved,email,3,5,Grace Villanueva
TKT-4410,2026-04-08,Product Quality,Frozen items thawed,"Frozen veggie burgers completely defrosted on arrival. Packaging was warm. I'm in California — is this a West Coast issue?",resolved,phone,2,8,Carlos Herrera
TKT-4411,2026-04-08,Membership,Auto-renewal surprise,"Why was I charged $12 this morning? I thought I cancelled my membership last month. I definitely clicked something to cancel.",open,chat,2,12,Priya Patel
TKT-4412,2026-04-08,Billing,Promo code not working,"Trying to apply the SPRING25 code but it says I'm not eligible. This is literally my first order ever. I signed up because of this promo.",resolved,chat,4,6,Marcus Rivera
TKT-4413,2026-04-08,Returns,Return process unclear,"I received the wrong protein powder flavor. Do I need to ship it back? I already opened it because I didn't realize until I used it.",resolved,email,4,4,Sofia Ramirez
TKT-4414,2026-04-08,Website Bug,Checkout error,"I keep getting an error when I click Place Order. Tried three times. My cart has 8 items and I've been trying for 20 minutes now.",resolved,chat,2,14,Jennifer Park
TKT-4415,2026-04-09,Product Quality,Frozen items thawed,"My frozen mango chunks were completely liquid inside the bag. There was barely any dry ice in the shipment. I ordered 5 frozen items and ALL of them were compromised.",resolved,chat,1,9,Tyler Brooks
TKT-4416,2026-04-09,Billing,Promo code not working,"The THRIVEMORE code that's supposedly 15% off frozen — not working. I created my account in 2023 if that matters. Super frustrating.",resolved,chat,3,8,David Thompson
TKT-4417,2026-04-09,Shipping,Late delivery,"Order placed 8 days ago, still showing processing. I ordered perishable items. Are they just sitting in a warehouse going bad?",open,phone,1,10,Isabella Moreno
TKT-4418,2026-04-09,Product Quality,Frozen items thawed,"Frozen ice cream arrived as a milkshake. Literally liquid. The box was warm when I picked it up from my porch.",resolved,email,2,5,Ana Reyes
TKT-4419,2026-04-09,Membership,Cancellation request,"I want to cancel my membership. I've been a member for 2 years but the product selection hasn't improved for my dietary needs (low FODMAP).",resolved,phone,4,14,Sarah Chen
TKT-4420,2026-04-09,Returns,Refund timing,"I submitted a return 10 days ago and still haven't gotten my refund. You said 3-5 business days. It's been 10.",open,chat,2,7,Marcus Rivera
TKT-4421,2026-04-09,Website Bug,Checkout error,"Place Order button isn't doing anything when I click it. No error message, just nothing happens. Using Chrome on my Mac.",resolved,chat,3,11,Jennifer Park
TKT-4422,2026-04-09,Billing,Promo code not working,"I got an email saying use code FREESHIP for free shipping on orders over $49. My cart is $67 but it's still charging me $5.95 for shipping. The code field says it was applied successfully but the shipping charge is still there.",resolved,chat,3,9,Priya Patel
TKT-4423,2026-04-09,Product Quality,Spoiled item,"Received organic milk that expires tomorrow. My delivery was already delayed 3 days. So by the time I got it the milk is basically expired.",resolved,email,3,5,Kevin Santos
TKT-4424,2026-04-10,Product Quality,Frozen items thawed,"Fourth order with frozen items, first time they arrived thawed. I'm in Oregon. Everything was soft and refrozen texture. Not safe to eat.",resolved,chat,3,7,Ashley Nguyen
TKT-4425,2026-04-10,Billing,Promo code not working,"THRIVEMORE isn't working and neither is SPRING25. I want to use at least ONE promo code. My account was created in Jan 2023.",resolved,chat,2,10,Tyler Brooks
TKT-4426,2026-04-10,Shipping,Package not received,"Tracking says delivered yesterday at 2:14 PM but I was home all day and nothing was delivered. I checked with my neighbors too.",resolved,phone,3,9,Carlos Herrera
TKT-4427,2026-04-10,Membership,Auto-renewal surprise,"Just noticed a $60 charge on my credit card from Thrive Market. I signed up for a free trial A YEAR AGO and forgot about it. I never ordered anything.",resolved,chat,2,8,Grace Villanueva
TKT-4428,2026-04-10,Product Quality,Frozen items thawed,"My frozen blueberries and frozen cauliflower rice were both thawed. The gel packs were warm. I'm starting to think Thrive can't handle frozen shipping.",resolved,email,2,5,Mei Lin Tan
TKT-4429,2026-04-10,Website Bug,Checkout error,"Getting a white screen when I try to go to checkout. Cart page works fine but clicking checkout just goes blank. Tried on my phone too — same thing.",open,chat,1,15,Jennifer Park
TKT-4430,2026-04-10,Other,Account access,"I can't log into my account. Reset password link isn't arriving in my email. I've checked spam. It's been 30 minutes.",resolved,chat,4,6,David Thompson
TKT-4431,2026-04-10,Billing,Duplicate charge,"I was charged twice for the same order — $87.42 on April 8 and again on April 9. Same amount, same card.",resolved,phone,3,10,Isabella Moreno
TKT-4432,2026-04-10,Shipping,Late delivery,"My order with frozen items shipped on Monday (ships Mon-Wed for frozen right?) but it's Thursday and FedEx says it won't arrive until Saturday. That's 5 days for frozen food.",open,chat,2,8,Marcus Rivera
TKT-4433,2026-04-11,Product Quality,Frozen items thawed,"This is my SECOND order in two weeks where frozen items arrived thawed. Last time I got a refund but I actually want the food, not refunds. Fix your cold chain.",resolved,chat,1,9,Sarah Chen
TKT-4434,2026-04-11,Billing,Promo code not working,"I have three promo codes and none of them work. THRIVEMORE — invalid. SPRING25 — not eligible. FREESHIP — applied but still charging shipping. What is going on?",resolved,chat,2,12,Priya Patel
TKT-4435,2026-04-11,Membership,Billing confusion,"I'm being charged $12/month but I thought I signed up for the $60/year plan. That's $144/year vs $60. Can you switch me and refund the difference?",resolved,phone,3,11,Carmen Reyes
TKT-4436,2026-04-11,Product Quality,Frozen items thawed,"Frozen edamame thawed. Frozen waffles thawed. Literally everything frozen in my order was ruined. I'm in Washington state.",resolved,email,2,5,Jose Garcia
TKT-4437,2026-04-11,Returns,Return label issue,"I need to return some supplements but the return label link in my email gives a 404 error. Dead link.",resolved,chat,4,5,Tyler Brooks
TKT-4438,2026-04-11,Shipping,Wrong address,"I just placed an order but realized I put my old address. It still says Processing — can you change it to my new address?",resolved,chat,5,4,Ashley Nguyen
TKT-4439,2026-04-11,Billing,Promo code not working,"The THRIVEMORE code gives me an error that says 'code not recognized' but I'm looking at the promotional email from Thrive right now that says to use it.",resolved,email,3,6,Kevin Santos
TKT-4440,2026-04-11,Membership,Auto-renewal surprise,"I got charged $60 and the renewal email only came 3 days before the charge. That's not enough notice. I would have cancelled if I'd had time to think about it.",resolved,chat,2,9,Marcus Rivera
TKT-4441,2026-04-11,Product Quality,Damaged packaging,"Received a case of canned beans and 4 of the 6 cans are severely dented. I don't feel comfortable eating from dented cans.",resolved,email,3,5,Sofia Ramirez
TKT-4442,2026-04-11,Website Bug,Search not working,"The search function on your website is returning zero results for everything. I've tried searching 'almonds' 'protein' 'snacks' — all show no results.",resolved,chat,3,7,Jennifer Park
TKT-4443,2026-04-12,Product Quality,Frozen items thawed,"I just received my order and every single frozen item is thawed. This is ridiculous. I ordered $45 worth of frozen food and it's all garbage now. I want a full refund AND credit for my trouble.",resolved,phone,1,13,Sarah Chen
TKT-4444,2026-04-12,Billing,Promo code not working,"Code THRIVEMORE from your email campaign isn't working for my account. I've been a member since 2021. The error says 'invalid promo code'.",resolved,chat,3,8,David Thompson
TKT-4445,2026-04-12,Shipping,Late delivery,"Ordered last Monday, still haven't received it. Customer service told me 3-7 business days but it's been 8 business days now.",open,email,2,5,Lucia Fernandez
TKT-4446,2026-04-12,Returns,Return process unclear,"I want to return some face wash that broke me out. It's been opened and used twice. Can I still return it? It's a personal care item.",resolved,chat,4,6,Tyler Brooks
TKT-4447,2026-04-12,Membership,Auto-renewal surprise,"WHY was I charged again? I've contacted you twice before about cancelling. Each time I was told it was cancelled and then I get charged again.",resolved,phone,1,15,Isabella Moreno
TKT-4448,2026-04-12,Other,Allergen concern,"I just bought your house brand granola and I need to know if it's produced in a facility that also processes tree nuts. My daughter has a severe allergy and the label just says 'may contain'.",open,email,4,6,Priya Patel
TKT-4449,2026-04-12,Product Quality,Frozen items thawed,"Frozen chicken tenders completely thawed and smell bad. I'm worried about food safety. These were supposed to stay frozen. I don't even want a replacement — I want to know this won't happen again.",resolved,chat,2,8,Carmen Reyes
TKT-4450,2026-04-12,Billing,Promo code not working,"Tried using code THRIVEMORE. Says invalid. My account email is the same one I used to sign up in 2023. I feel like long-time members are being excluded from promos.",resolved,chat,2,9,Marcus Rivera
TKT-4451,2026-04-12,Shipping,Damaged in transit,"Three glass jars broken in my order — pasta sauce, salsa, and pickles. The box was clearly dropped. Everything else in the box is covered in sauce.",resolved,email,3,6,Ana Reyes
TKT-4452,2026-04-12,Membership,Cancellation request,"I want to cancel. The prices used to be competitive but now I can find the same products cheaper at Costco. Sorry but it doesn't make financial sense anymore.",resolved,phone,4,12,Sarah Chen
TKT-4453,2026-04-13,Product Quality,Frozen items thawed,"My frozen fruit smoothie packs were thawed and leaking. The box was wet on the outside when the driver dropped it off. Whatever cold chain you're using for the West Coast is failing.",resolved,chat,2,7,Rafael Cruz
TKT-4454,2026-04-13,Billing,Promo code not working,"SPRING25 says I'm not eligible for this promotion. But I literally just created my account TODAY to use this code. Your Instagram ad says it's for new members.",resolved,chat,3,8,Ashley Nguyen
TKT-4455,2026-04-13,Shipping,Late delivery,"It's been 12 days since I ordered. I keep getting told 'it's on the way' but the tracking hasn't moved from the origin facility.",open,phone,1,10,Carlos Herrera
TKT-4456,2026-04-13,Website Bug,Checkout error,"I click 'Place Order' and the page just refreshes. Doesn't show an error, doesn't confirm the order. I've tried 5 times. My card isn't being charged at least.",open,chat,2,10,Jennifer Park
TKT-4457,2026-04-13,Membership,Auto-renewal surprise,"Got the renewal email only 3 days before being charged. That's not enough time. I opened it planning to cancel but by the time I got around to it the next day, I was already charged.",resolved,chat,2,8,Grace Villanueva
TKT-4458,2026-04-13,Product Quality,Wrong item,"Ordered almond butter, received peanut butter. My son is allergic to peanuts. This is a serious issue — what if he had eaten it without checking?",resolved,phone,1,12,Sarah Chen
TKT-4459,2026-04-13,Returns,Refund timing,"Returned items on March 28 via the prepaid label. USPS shows it was delivered to your returns center April 2. Still no refund as of today (April 13). That's 11 days since you received it.",open,email,2,5,Kevin Santos
TKT-4460,2026-04-13,Other,Subscription question,"How do I skip my next subscription delivery? I can't find the option anywhere in my account. The app and website both seem different from the instructions you emailed me.",resolved,chat,5,4,David Thompson
TKT-4461,2026-04-13,Billing,Duplicate charge,"There are two pending charges on my card for $52.18 from April 11. I only placed one order. Is one of them just a hold?",resolved,chat,4,7,Marcus Rivera
TKT-4462,2026-04-13,Product Quality,Frozen items thawed,"I'm at 3 out of my last 4 frozen orders arriving thawed. At this point I've given up on ordering frozen from Thrive. Just want a refund for this latest one.",resolved,email,2,5,Patricia Lim
TKT-4463,2026-04-14,Shipping,Late delivery,"Ordered April 3 and it's April 14. 11 days. The tracking number doesn't even work anymore — just says 'not found' when I look it up.",open,chat,1,9,Tyler Brooks
TKT-4464,2026-04-14,Billing,Promo code not working,"FREESHIP code is 'applied' according to the green checkmark but my shipping charge didn't change. Still showing $5.95. Cart total is $52 which is over the $49 minimum.",resolved,chat,3,8,Priya Patel
TKT-4465,2026-04-14,Product Quality,Frozen items thawed,"Just got my first frozen order from Thrive and everything is thawed. Frozen berries are juice. Frozen pizza is floppy. Not a great first impression for a new member.",resolved,chat,2,7,Ashley Nguyen
TKT-4466,2026-04-14,Membership,Cancellation request,"Cancelling because I moved abroad and you don't ship internationally. Can I get a pro-rated refund for the remaining 7 months of my annual membership?",resolved,email,5,4,Sofia Ramirez
TKT-4467,2026-04-14,Returns,Return label issue,"The return label you emailed me shows the wrong return address. It's going to some random warehouse in Nevada instead of your returns center.",resolved,chat,3,8,Carmen Reyes
TKT-4468,2026-04-14,Website Bug,Account page error,"My order history page is showing someone else's orders. I can see orders with a different name and address. This is a privacy issue.",open,phone,1,15,Sarah Chen
TKT-4469,2026-04-14,Product Quality,Spoiled item,"Received organic chicken broth that's past its expiration date. Best by date was March 20, 2026. My order arrived April 10.",resolved,email,3,4,Jose Garcia
TKT-4470,2026-04-14,Billing,Promo code not working,"I'm trying to stack SPRING25 and FREESHIP but when I add the second code it removes the first one. Your FAQ says promo stacking is supported now.",resolved,chat,3,9,Marcus Rivera
TKT-4471,2026-04-14,Shipping,Package not received,"Package shows delivered to my address at 11:30 AM. I have a Ring camera and there's no footage of any delivery. FedEx left it at the wrong house.",resolved,chat,3,9,David Thompson
TKT-4472,2026-04-14,Membership,Auto-renewal surprise,"I specifically remember cancelling. I went through the whole process and clicked confirm. But I just got charged $12 again. Something is broken with your cancellation system.",resolved,phone,1,13,Isabella Moreno
TKT-4473,2026-04-14,Product Quality,Frozen items thawed,"Frozen wild-caught shrimp arrived thawed and smelling fishy. I opened the bag to check and it's clearly been thawed for a while. This is a food safety issue.",resolved,chat,1,8,Carmen Reyes
TKT-4474,2026-04-14,Other,Account access,"My account shows a different email address than the one I signed up with. I didn't change it. Did someone hack my account?",open,phone,2,12,Sarah Chen
TKT-4475,2026-04-14,Billing,Overcharge,"My order total at checkout was $43.17 but my card was charged $48.12. Where did the extra $4.95 come from?",resolved,chat,3,7,Priya Patel
TKT-4476,2026-04-07,Shipping,Late delivery,"Two weeks waiting for my order. TWO WEEKS. This is supposed to be 3-7 days. I'm seriously considering cancelling my membership over this.",open,email,1,5,Lucia Fernandez
TKT-4477,2026-04-07,Product Quality,Frozen items thawed,"Frozen organic peas arrived thawed and sitting in water inside the bag. Also the frozen mac and cheese was room temperature. This is from my very first frozen order with Thrive.",resolved,chat,2,7,Rafael Cruz
TKT-4478,2026-04-07,Billing,Promo code not working,"My friend gave me her referral code and it won't apply. She also tried THRIVEMORE and it's not working for her either. She's been a member since 2022.",resolved,email,3,6,Kevin Santos
TKT-4479,2026-04-08,Membership,Auto-renewal surprise,"Saw a charge for $60 from Thrive Market. I only signed up for the free trial to see if I liked it. I never got a clear warning it would auto-renew at $60.",resolved,chat,2,9,Grace Villanueva
TKT-4480,2026-04-08,Product Quality,Frozen items thawed,"The frozen fruit bars I ordered were melted and then refrozen — you can tell because the shape is all wrong and the coating is cracked. Clearly a cold chain issue.",resolved,chat,2,7,Tyler Brooks
TKT-4481,2026-04-08,Shipping,Damaged in transit,"Half my order arrived crushed. The box was ripped on one side and items were falling out of the hole.",resolved,email,3,5,Ana Reyes
TKT-4482,2026-04-08,Returns,Return process unclear,"I received a duplicate shipment of the same order. I want to return the extra one. Do I need to pay for return shipping?",resolved,chat,5,5,Ashley Nguyen
TKT-4483,2026-04-09,Billing,Promo code not working,"THRIVEMORE gives me 'this promotional code is not valid for your account.' I've been a loyal member for 3 years. Are you excluding existing members from frozen deals?",resolved,phone,2,9,Carlos Herrera
TKT-4484,2026-04-09,Product Quality,Frozen items thawed,"Three bags of frozen vegetables thawed. This is the third complaint I'm filing about frozen items this month. Please escalate this to management.",resolved,chat,1,10,Sarah Chen
TKT-4485,2026-04-09,Shipping,Late delivery,"My order shipped April 1 and it's April 9. Tracking shows it's been sitting at a FedEx facility in Memphis for 5 days.",open,chat,2,8,Marcus Rivera
TKT-4486,2026-04-09,Website Bug,Checkout error,"I placed my order, got a confirmation page, but no confirmation email. And the order doesn't show up in my account. Was I charged?",resolved,chat,2,11,Jennifer Park
TKT-4487,2026-04-10,Membership,Auto-renewal surprise,"Just discovered I've been charged $12/month for 6 months and never used the membership. Not once. Can I get all 6 months refunded?",resolved,phone,2,14,Isabella Moreno
TKT-4488,2026-04-10,Product Quality,Frozen items thawed,"Frozen breakfast burritos thawed. Frozen smoothie bowls thawed. I'm in California and it seems like every frozen order from the West Coast is affected.",resolved,email,2,5,Mei Lin Tan
TKT-4489,2026-04-10,Billing,Promo code not working,"FREESHIP applied at checkout but when I look at my order confirmation email the shipping charge is still there. Was I charged for shipping or not?",resolved,chat,3,7,David Thompson
TKT-4490,2026-04-10,Other,Product recommendation,"Looking for keto-friendly snack recommendations. Your website filter for keto doesn't seem very comprehensive. Am I missing something?",resolved,chat,5,5,Rafael Cruz
TKT-4491,2026-04-10,Shipping,Wrong item delivered,"Received someone else's entire order. None of these items are mine. My name isn't even on the packing slip.",resolved,phone,3,9,Carmen Reyes
TKT-4492,2026-04-11,Billing,Promo code not working,"I applied SPRING25 to my first order but the discount is only 20%, not 25%. It took 20% off instead of 25%. Math doesn't match the promo name.",resolved,chat,3,7,Priya Patel
TKT-4493,2026-04-11,Product Quality,Frozen items thawed,"My frozen gluten-free waffles arrived thawed. The dry ice in the package was maybe a quarter of what it should be. Tiny piece. Of course everything thawed.",resolved,chat,2,7,Grace Villanueva
TKT-4494,2026-04-11,Membership,Cancellation request,"I want to cancel. Between the promo codes never working and the frozen items always arriving thawed, I'm done. Nothing against your team but the experience has been terrible.",resolved,phone,2,15,Sarah Chen
TKT-4495,2026-04-11,Returns,Refund timing,"It's been 15 business days since my return was delivered to your warehouse and I still haven't received my refund. Your policy says 3-5 days.",open,email,1,5,Sofia Ramirez
TKT-4496,2026-04-11,Website Bug,Checkout error,"White screen of death when I hit checkout. Been happening for 3 days. Tried Chrome, Safari, and Firefox. Same result.",open,chat,1,10,Jennifer Park
TKT-4497,2026-04-12,Product Quality,Frozen items thawed,"Frozen salmon fillets arrived thawed and discolored. I paid premium for wild-caught and it arrives looking like it's been sitting on a counter all day.",resolved,chat,1,8,Tyler Brooks
TKT-4498,2026-04-12,Billing,Promo code not working,"Your Instagram ad has a promo code THRIVE30 that I can't find anywhere in the app. Is this real? When I type it in it says 'code not found'.",resolved,chat,4,5,Ashley Nguyen
TKT-4499,2026-04-12,Shipping,Late delivery,"My subscribe-and-save order was supposed to arrive April 5. It's April 12 and it hasn't even shipped yet. What's the point of subscribing if it doesn't ship on time?",open,email,2,5,Jose Garcia
TKT-4500,2026-04-12,Membership,Auto-renewal surprise,"Got the renewal reminder email on April 9 and was charged on April 12. 3 days notice for a $60 charge is not cool. Your old email used to come a week before.",resolved,chat,3,7,Marcus Rivera
TKT-4501,2026-04-13,Product Quality,Spoiled item,"Opened my almond milk and it smelled sour even though the expiration is next month. The carton was slightly bulging too.",resolved,chat,3,6,David Thompson
TKT-4502,2026-04-13,Shipping,Package not received,"USPS says delivered but nothing at my door. I live in an apartment building and packages often get stolen from the lobby. Can you reship?",resolved,chat,3,8,Carmen Reyes
TKT-4503,2026-04-13,Product Quality,Frozen items thawed,"I ordered the frozen family meal pack — 6 items, all thawed. $67 worth of food I have to throw away. This is the worst online shopping experience I've had.",resolved,phone,1,11,Isabella Moreno
TKT-4504,2026-04-13,Other,Allergen concern,"Does your Thrive Market brand chocolate contain soy lecithin? I have a soy allergy and the product page doesn't list full ingredients.",open,email,4,5,Kevin Santos
TKT-4505,2026-04-13,Billing,Overcharge,"I used a $15 credit but my total didn't change. It should have gone from $62 to $47 but I was charged the full $62.",resolved,chat,2,9,Priya Patel
TKT-4506,2026-04-13,Website Bug,Search not working,"I search for 'organic pasta' and get zero results. But if I browse the pasta category manually I can see dozens of organic options. Your search is broken.",resolved,chat,3,6,Jennifer Park
TKT-4507,2026-04-14,Product Quality,Frozen items thawed,"My frozen organic chicken nuggets were completely thawed and warm. I live in San Diego. I think your West Coast frozen carrier is the problem here.",resolved,chat,2,7,Sarah Chen
TKT-4508,2026-04-14,Billing,Promo code not working,"I have a screenshot of the email you sent with THRIVEMORE code. Pasting it exactly. Still invalid. This is false advertising if the code doesn't actually work.",resolved,email,1,5,Lucia Fernandez
TKT-4509,2026-04-14,Shipping,Late delivery,"It's day 9 and my order is still sitting in a warehouse in California according to tracking. I'm in Arizona. How does it take 9 days to go one state over?",open,chat,2,7,Tyler Brooks
TKT-4510,2026-04-14,Membership,Cancellation request,"Cancel my membership effective immediately. Don't try to offer me anything. I've had 4 bad experiences in a row and I'm done.",resolved,chat,3,6,Grace Villanueva
TKT-4511,2026-04-07,Shipping,Late delivery,"Placed my order March 29 and it's April 7. Still no delivery. Support told me last week it would arrive by Friday and it didn't.",open,email,1,5,Sofia Ramirez
TKT-4512,2026-04-07,Other,Subscription question,"I want to change the frequency of my coffee subscription from every 2 weeks to every 4 weeks. Can't figure out how to do it on the website.",resolved,chat,5,4,Ashley Nguyen
TKT-4513,2026-04-08,Product Quality,Damaged packaging,"My order of olive oils came with one bottle cracked and leaking. The other two are fine but covered in oil from the broken one.",resolved,email,3,5,Jose Garcia
