ticket_id,created_date,reason_for_contact,sub_reason,member_message,resolution_status,channel,CSAT_score,handle_time_minutes,agent_name
TKT-4514,2026-04-08,Billing,Promo code not working,"Code THRIVEMORE — invalid. My account is from 2022. Please check if there's an account age cutoff blocking the code.",resolved,chat,2,8,Carmen Reyes
TKT-4515,2026-04-08,Shipping,Package not received,"My neighbors found my package 4 houses down. It was left in their bushes. The address label had the right address. FedEx driver just can't read apparently.",resolved,chat,4,5,Marcus Rivera
TKT-4516,2026-04-09,Membership,Auto-renewal surprise,"Charged $60 for annual renewal. The new email design is confusing — I saw it but thought it was a marketing email, not a renewal notice. It looks like an ad.",resolved,chat,3,8,David Thompson
TKT-4517,2026-04-09,Product Quality,Wrong item,"Ordered sugar-free granola bars, received regular ones. I'm diabetic and can't eat these. This could be a health issue.",resolved,phone,2,10,Sarah Chen
TKT-4518,2026-04-09,Returns,Return process unclear,"Do I need to return expired products? I have 3 items from my last order that were past expiration on arrival.",resolved,chat,4,5,Tyler Brooks
TKT-4519,2026-04-10,Billing,Promo code not working,"THRIVEMORE just spins and then says error. Tried it 4 times. My internet is fine — every other website works.",resolved,chat,2,7,Rafael Cruz
TKT-4520,2026-04-10,Other,Product recommendation,"I'm trying to switch to all-organic household cleaning products. What do you recommend from your selection? Your categories are a bit confusing to navigate.",resolved,chat,5,8,Priya Patel
TKT-4521,2026-04-10,Shipping,Damaged in transit,"My glass jar of tahini arrived cracked and half empty. It leaked onto my other groceries. The packaging had zero bubble wrap or protection for the glass.",resolved,email,3,5,Ana Reyes
TKT-4522,2026-04-10,Membership,Billing confusion,"I see two different membership charges — $12 on March 1 and $60 on March 15. Was I double-charged? It looks like I'm on both monthly and annual.",resolved,phone,2,11,Isabella Moreno
TKT-4523,2026-04-11,Product Quality,Frozen items thawed,"Another thawed frozen order. Frozen corn, frozen spinach, and frozen berries — all warm. I'm done ordering frozen from Thrive until you fix this.",resolved,chat,2,7,Carmen Reyes
TKT-4524,2026-04-11,Billing,Promo code not working,"Neither THRIVEMORE nor FREESHIP is working for me. THRIVEMORE says invalid, FREESHIP says applied but doesn't change the total. I give up.",resolved,chat,1,10,Grace Villanueva
TKT-4525,2026-04-11,Shipping,Late delivery,"My subscription order is 6 days late. I subscribe specifically so I don't run out of staples. Now I have to go to the grocery store anyway, which defeats the purpose.",open,chat,3,6,David Thompson
TKT-4526,2026-04-12,Product Quality,Frozen items thawed,"Frozen açaí packets arrived as liquid. I'm in Portland, OR. Every frozen order to the Pacific Northwest seems to have this problem.",resolved,email,2,5,Mei Lin Tan
TKT-4527,2026-04-12,Membership,Cancellation request,"I love Thrive's mission but I can't justify the membership fee anymore since I'm buying less. Can I pause instead of fully cancelling?",resolved,chat,5,7,Marcus Rivera
TKT-4528,2026-04-12,Returns,Refund timing,"Where is my $34 refund? It's been 2 weeks since I returned the items. I can see the return was received based on the tracking. Getting really frustrated.",open,email,2,5,Kevin Santos
TKT-4529,2026-04-12,Website Bug,Checkout error,"Checkout is completely broken. I've been trying every day for 4 days. White screen, frozen loading, or just nothing happens. I'm about to cancel my membership because I literally can't place orders.",open,chat,1,12,Jennifer Park
TKT-4530,2026-04-13,Billing,Promo code not working,"The THRIVEMORE code your customer service rep told me to use last week still doesn't work. She said it would be fixed by today. It's not.",resolved,phone,1,10,Carlos Herrera
TKT-4531,2026-04-13,Product Quality,Frozen items thawed,"Frozen organic berries soup. That's what I got. Berry soup. Because they were thawed into mush. Along with my frozen waffles which were just sad floppy discs.",resolved,chat,2,7,Ashley Nguyen
TKT-4532,2026-04-13,Shipping,Late delivery,"Subscribe-and-save order 10 days late. Third month in a row it's been late. Is this a recurring problem or am I just unlucky?",open,email,2,5,Jose Garcia
TKT-4533,2026-04-14,Billing,Promo code not working,"I signed up as a new member today SPECIFICALLY because of the SPRING25 code. Now it says I don't qualify. If you don't honor this I'm requesting a full membership refund.",resolved,chat,2,10,Tyler Brooks
TKT-4534,2026-04-14,Product Quality,Frozen items thawed,"Frozen turkey burgers thawed. Frozen mixed vegetables thawed. But interestingly the frozen fruit was still partially frozen — so some items are worse than others.",resolved,chat,3,7,David Thompson
TKT-4535,2026-04-14,Membership,Auto-renewal surprise,"Annual renewal hit my card 3 days after the email. I tried to cancel on the second day after getting the email but there was no obvious cancel button on the membership page. I had to dig through settings.",resolved,chat,2,9,Priya Patel
TKT-4536,2026-04-07,Other,Account access,"I moved and changed my email. Now I can't access my account because 2FA goes to the old email address.",resolved,phone,3,11,Sarah Chen
TKT-4537,2026-04-08,Product Quality,Spoiled item,"Organic eggs arrived with 2 cracked and the rest sitting in egg yolk. The carton was not properly secured in the box.",resolved,email,3,5,Valentina Torres
TKT-4538,2026-04-09,Shipping,Damaged in transit,"My entire order smells like the fish sauce bottle that shattered inside the box. Everything is contaminated. Even the sealed items smell.",resolved,chat,2,8,Marcus Rivera
TKT-4539,2026-04-10,Billing,Duplicate charge,"I'm seeing three charges from Thrive this month: $47.22, $47.22, and $12.00. The first two look like duplicates. The $12 is my membership.",resolved,phone,2,11,Isabella Moreno
TKT-4540,2026-04-11,Product Quality,Frozen items thawed,"This makes 5 thawed frozen orders for me in the past month. FIVE. I keep getting refunds but I want the actual food to arrive frozen. What is going on with ColdPack?",resolved,chat,1,9,Carmen Reyes
TKT-4541,2026-04-12,Website Bug,Account page error,"My saved payment method is showing the full card number — not masked. I can see all 16 digits. This has to be a security issue.",open,phone,1,14,Sarah Chen
TKT-4542,2026-04-12,Shipping,Late delivery,"My birthday gift order for my mom was supposed to arrive April 8. It's April 12 and her birthday was yesterday. Totally missed it.",open,chat,1,8,Grace Villanueva
TKT-4543,2026-04-13,Billing,Promo code not working,"FREESHIP is applied but tax calculation changed. Before applying the code my total was $53.12 with tax. After applying FREESHIP my total is $53.12 with shipping removed but tax increased. Net savings: $0.",resolved,chat,3,9,Tyler Brooks
TKT-4544,2026-04-13,Product Quality,Frozen items thawed,"This is getting absurd. Thawed frozen items for the 3rd order in a row. I'm in Seattle. Switching to Imperfect Foods for frozen — they've never sent me thawed items.",resolved,email,1,5,Patricia Lim
TKT-4545,2026-04-14,Shipping,Package not received,"Package marked delivered at 3 PM but I have a doorbell camera that shows no delivery. I live on a rural route — I think FedEx just marked it delivered without actually delivering.",resolved,phone,2,10,Carlos Herrera
TKT-4546,2026-04-14,Product Quality,Frozen items thawed,"Frozen bone broth arrived as regular liquid broth. Box was warm. Delivery driver said the package had been sitting at the local facility for 2 days.",resolved,chat,2,7,Marcus Rivera
TKT-4547,2026-04-14,Billing,Promo code not working,"THRIVEMORE — invalid code error. My account was created September 2023. I saw someone on Reddit say it only works for accounts made after January 2024. Is that true?",resolved,chat,2,8,Sarah Chen
TKT-4548,2026-04-07,Membership,Cancellation request,"Please cancel. I've been happy with Thrive but my financial situation changed and I need to cut non-essentials.",resolved,chat,4,8,Ashley Nguyen
TKT-4549,2026-04-09,Other,Allergen concern,"I purchased your Thrive Market brand almond flour. The bag doesn't mention whether it's processed in a facility with wheat. My wife has celiac. Can you confirm?",open,email,4,5,Priya Patel
TKT-4550,2026-04-11,Shipping,Wrong item delivered,"I ordered 2 bags of quinoa and received 2 bags of white rice. Order number TM-9918234. Can you send the correct items?",resolved,chat,4,6,David Thompson